{
  "schema": "freshlybaked.lp.events-batch.v1",
  "replica_id": "mss-1",
  "sent_at": "2026-06-10T14:20:00Z",
  "events": [
    {
      "event_id": "evt_01J9X2K3M4N5P6Q7R8S9T0",
      "event_type": "lp_impression",
      "event_ts": "2026-06-10T14:18:42Z",
      "replica_id": "mss-1",
      "bundle_id": "lpb_2026-06-10_140312_7f3a91",
      "policy_id": "polv_2026-06-10_01",
      "policy_rule_id": "rule_delivery_near_me",
      "experiment_id": "exp_delivery_near_me_2026q2",
      "assignment_id": "asg_9f2c7a1b",
      "assignment_key_type": "gclid",
      "branch_id": "2",
      "selected_variants": { "X1": "hero_speed_b", "X5": "cta_order_now_a" },
      "counterfactual_variants": { "X1": "hero_speed_a", "X5": "cta_order_now_a" },
      "candidate_weights": {
        "X1": [
          { "variant_id": "hero_speed_a", "weight": 9500 },
          { "variant_id": "hero_speed_b", "weight": 500 }
        ]
      },
      "served_probability_bps": 500,
      "bucket_bps": 137,
      "gclid_hash": "h_3d9a0c4e",
      "site": "midtown",
      "family": "weed-delivery-near-me",
      "cluster_slug": "delivery-near-me",
      "traffic_flags": ["paid_google"]
    },
    {
      "event_id": "evt_01J9X2K3M4N5P6Q7R8S9T1",
      "event_type": "lp_conversion",
      "event_ts": "2026-06-10T14:19:55Z",
      "replica_id": "mss-1",
      "bundle_id": "lpb_2026-06-10_140312_7f3a91",
      "policy_id": "polv_2026-06-10_01",
      "policy_rule_id": "rule_delivery_near_me",
      "assignment_id": "asg_9f2c7a1b",
      "assignment_key_type": "gclid",
      "branch_id": "2",
      "site": "midtown",
      "family": "weed-delivery-near-me",
      "cluster_slug": "delivery-near-me",
      "traffic_flags": ["paid_google"]
    }
  ]
}
